Title,Price,Subscriber Count,Number of Reviews,Course Length
Learn Web Designing & HTML5/CSS3 Essentials in 4-Hours,75,43285,525,4 hours
Learning Dynamic Website Design - PHP MySQL and JavaScript,50,47886,285,12.5 hours
ChatBots: Messenger ChatBot with API.AI and Node.JS,50,2577,529,4.5 hours
Projects in HTML5,60,8777,206,15.5 hours
Programming Foundations: HTML5 + CSS3 for Entrepreneurs 2015,20,23764,490,5.5 hours
How To Make A Wordpress Website 2017 | Divi Theme Tutorial,40,3541,202,4 hours
Build Your Own Backend REST API using Django REST Framework,50,2669,112,5.5 hours
Angular and Firebase - Build a Web App with Typescript,150,1966,359,5 hours
Web Development Masterclass - Complete Certificate Course,200,4090,178,19.5 hours
Spring Boot Tutorial For Beginners,40,2578,210,5.5 hours
The Complete Bootstrap Masterclass Course - Build 4 Projects,195,24978,540,7 hours
Scaling Docker on AWS,25,3133,351,6 hours
Learn JavaScript for beginners,200,15276,167,1.5 hours
HTML Tutorial: HTML & CSS for Beginners,20,12458,253,4 hours
Learn by Doing: Vue JS 2.0 the Right Way,95,1087,220,3.5 hours
Learn Complete Web Development From Scratch,40,14074,106,12 hours
Introduction to Web Development: HTML,20,26800,333,3 hours
Web Site for Beginners - Learn Web Building like knitting,20,9425,147,1.5 hours
How To Make A Wordpress Website 2017 - Divi Theme Tutorial,40,2780,94,3 hours
Web Programming with Python,50,35267,217,4 hours
PHP Login and Registration System - Email Confirm Activation,100,2607,317,5 hours
PSD to Responsive HTML5: Beginner to Advanced,40,1502,218,6 hours
Ultimate Web Developer Course Build 10 Websites from Scratch,200,9359,110,32.5 hours
Rapid Website Design with Bootstrap,200,14842,131,1 hour
Build Enterprise Applications with Angular 2 (and Angular 4),190,6082,848,9.5 hours
Angular 4 (2+) Crash Course for Beginners,120,12366,506,9 hours
Accelerated JavaScript Training,110,4720,1017,7.5 hours
Beginner API development in Node, Express, ES6, & MongoDB,165,7057,655,18.5 hours
React JS and Redux - Mastering Web Apps,60,16829,820,5 hours
Web Development w/ Google’s Go (golang) Programming Language,65,4872,662,19 hours
Git a Web Developer Job: Mastering the Modern Workflow,200,5809,1445,15 hours
The Complete WordPress Website Business Course,150,13439,1981,20.5 hours
The Complete HTML and CSS Course For Beginners,85,733,104,3 hours
Learn  Bootstrap Development By Building 10 Projects,60,14813,1358,13.5 hours
Advanced Javascript,200,6601,1304,3.5 hours
Dissecting Ruby on Rails 5 - Become a Professional Developer,195,2804,418,37.5 hours
The Complete Wordpress Course - Build Your Own Website Today,195,9421,73,3.5 hours
JQuery Essentials core training for Dynamic Interactive web,100,9668,38,4 hours
Node.js: The Essentials + API Frameworks Express KOA Sails,20,2760,52,1 hour
The Complete PHP Bootcamp Course With Video Sharing Project,195,9831,56,14.5 hours
Build a Single Page Application with jQuery & AJAX,60,486,59,2 hours
Practical CSS Website Development: Crash Course ,95,11170,35,2.5 hours
Successful website creation - everything you need to know,150,9384,21,1.5 hours
Start Writing JavaScript Today - Beginner JavaScript Course,100,9067,41,3 hours
HTML5 Essentials for Beginners,20,10247,200,1.5 hours
Code a personal splash page in 1 hour,20,10610,83,1 hour
Step-by-step HTML and CSS for Absolute Beginners,120,6162,324,4 hours
Angular 4 Development Decoded,20,1802,13,1 hour
Javascript ES6! A Complete Reference Guide to Javascript ES6,175,4783,41,7 hours
Reactive JS:  Are you ready for the next big paradigm shift?,60,2097,401,5.5 hours
Learn Python and Django: Payment Processing,70,17714,198,3.5 hours
Code your first Website using HTML & CSS: Project Learning,20,9554,368,1.5 hours
React.js: Building Production Ready Apps, Start to Finish,50,1129,137,17.5 hours
Learn Object Oriented Programming PHP fundamentals bootcamp,100,22213,142,1 hour
Javascript Intermediate level 2 - Mastering Functions,100,2412,116,2.5 hours
1 Hour CSS,100,18324,333,1 hour
Become a Full Stack Developer with Spring, AWS and Stripe,75,1696,193,10 hours
Complete JQuery And JQuery UI Course For Beginner,80,7169,277,1 hour
Learn JavaScript for Web Development,75,12893,220,8.5 hours
Complete AJAX Using Bootstrap, PHP From Basic To Advanced.,195,4708,111,2.5 hours
Complete Wordpress Theme Development Course,150,1050,223,6.5 hours
How to Optimise Your WordPress Website's Speed & Security to Improve SEO & User Experience,125,7852,46,3.5 hours
Build A Web App With Spring Framework and Angular 2,145,1683,340,8 hours
Projects in Laravel: Learn Laravel Building 10 Projects,50,119,6,10.5 hours
Javascript Intermediate level 3 - JSON,100,1735,76,2.5 hours
Develop Your First App in an Hour,20,3699,201,1 hour
PHP: Ultimate guide to PHP for everyone,115,10103,75,1.5 hours
JavaScript DOM Dynamic Web interactive content Boot Camp,75,7380,43,2.5 hours
Master JavaScript Programming, 3 Projects Included !!,20,3903,53,10.5 hours
HTML CSS Learn to create a website from scratch,50,4892,49,2 hours
Complete Codeigniter: From Beginner to Advanced,200,2786,31,3 hours
HTML 5: How I made websites in HTML5,135,15064,237,1.5 hours
Build Responsive Website Using HTML5, CSS3, JS And Bootstrap,95,22623,783,8 hours
Complete React JS web developer with ES6 - Build 10 projects,200,952,121,12 hours
Complete WordPress Theme Developer Course With Bootstrap,150,3415,312,25 hours
The Complete Ethical Hacking Course 2.0: Python & Kali Linux,195,7827,268,11 hours
Dynamic JavaScript Master Class AJAX JSON Simple APIs,200,9773,117,4.5 hours
Vue JS - Mastering Web Apps,80,13457,215,4.5 hours
Angular NgRx Store Masterclass - Covers Angular 4,150,1399,212,8.5 hours
JavaScript the Basics - JavaScript for Beginners,120,4028,674,9 hours
Complete E-Commerce Course - Java,Spring,Hibernate and MySQL,195,1371,165,20 hours
Learn SVG Animation - With HTML, CSS & Javascript,65,12953,680,1.5 hours
Build a Responsive Website with HTML5, CSS3 and Bootstrap 4,20,5125,395,7 hours
Learn Web Designing & HTML5/CSS3 Essentials in 4-Hours,75,43285,525,4 hours
CSS Development (with CSS3!),20,25864,188,5 hours
Angular 2 & TypeScript Beginner Web Development,200,5211,414,19.5 hours
The Docker for DevOps course: From development to production,25,8234,1111,7.5 hours
Beginner Full Stack Web Development: HTML, CSS, React & Node,200,2687,331,25.5 hours
Learn Angular 2 Development By Building 12 Apps,50,5143,941,12 hours
Server API Development in Swift, Kitura, & Bluemix,200,1827,129,20.5 hours
React VR - Creating Virtual Reality Apps,80,5026,72,3 hours
RxJs & Reactive Programming Angular Masterclass - Angular 4,150,1301,179,7.5 hours
Coding for Entrepreneurs: Learn Python, Django, and More.,195,23412,799,45 hours
React and Flux Web Development for Beginners,100,8691,836,11 hours
The Full Stack Web Development,60,3119,453,33 hours
Learn Nodejs by building 12 projects,50,10150,997,16 hours
How to Make an Online Portfolio Website from Scratch ,Free,14026,232,1 hour
How To Make A Web Page With No Code,Free,2214,20,2 hours
Spring Framework 4 And Dependency Injection For Beginners,Free,21147,1220,1.5 hours
Joomla 3 - The Basics,Free,19909,411,3 hours
jQuery in Action: Build 8 jQuery Projects,100,1385,89,11 hours
Master WordPress Plugins: Shortcodes Ultimate - The Basics,Free,10780,110,1 hour
ASP.NET C# - Enterprise Web Systems From Novice to Expert,20,604,8,3.5 hours
Wordpress - Create an Outstanding Website in 2 hours,30,1772,13,2.5 hours
Complete Website & CMS in PHP & MySQL From Scratch!,20,3357,82,12.5 hours
The Complete Web Development Tutorial Using React and Redux,40,796,43,4 hours
Create and Deploy a Web App in 3 Hours,50,4123,23,3.5 hours
HTML & CSS From Scratch in 30 Days,75,2697,64,11.5 hours
Getting Started with Craft CMS,20,997,31,2 hours
JavaScript For Absolute Beginners - Level One,65,713,80,1.5 hours
Effective Personal Website Building and Hosting,20,4259,0,1 hour
Web Design for Web Developers: Build Beautiful Websites!,Free,98867,6512,3 hours
Learn Rails: Quickly Code, Style and Launch 4 Web Apps,200,1849,21,3 hours
Getting Started with NodeJS for Beginners,195,1645,75,1 hour
Quickstart AngularJS,Free,64128,4047,1.5 hours
Byte-Sized-Chunks: Cascading Style Sheets (CSS) with HTML,20,2160,16,4 hours
Learn Building Your Own Website Without Coding,50,7660,7,2 hours
Practical Guide to Web Development,20,2025,16,2 hours
The Complete HTML5 and CSS3 Course,40,1548,30,15 hours
HTML & CSS for beginners: Build 3 projects from scratch,40,2472,139,4 hours
Code a 'Coming Soon' Landing Page in Bootstrap 4,Free,13535,473,1.5 hours
Introduction to Bootstrap 3,20,5795,79,2.5 hours
Master ExpressJS to Build Web Apps with NodeJS&JavaScript,50,2643,56,3.5 hours
Learn XML Crash Course: Discover Essential XML Fundamentals ,50,3704,111,2 hours
HTML5 CSS3 JQUERY Single Page Website Project from Scratch,120,1678,34,2.5 hours
Scrape Websites using PhantomJS and CasperJS,195,960,110,2 hours
Amazon s3 Mastery - THE How-To' Guides For Amazon S3,95,1811,118,3.5 hours
HTML and CSS Crash Course for Beginners,50,4123,46,4.5 hours
EMMET Faster HTML & CSS workflow - Best Tool For Developers ,Free,26697,1097,1 hour
Introduction to Web Development,50,5921,35,4.5 hours
AngularJS For ASP.NET MVC Developers,50,3011,57,1 hour
Serverless Workflow Management with AWS Step Functions,Free,8768,173,1 hour
How to set up a Web Server From Scratch to One Fully Managed,200,1673,31,3 hours
The Complete PHP MySQL Professional Course with 5 Projects,200,16158,159,19.5 hours
Angular Masterclass,150,4057,359,6.5 hours
Become a Professional Web Developer | Version 3.0,200,6851,276,60 hours
Build Incredible Chatbots,100,2234,253,11.5 hours
Try Django 1.10 | Create a URL Shortening Service,50,9607,78,5.5 hours
Projects in CSS,60,4689,216,10 hours
Ruby on Rails: Training and Skills to Build Web Applications,95,9375,219,7 hours
Learn and Understand React,30,4848,105,16.5 hours
Learn Javascript & JQuery From Scratch,30,84897,2685,2 hours
Learn to use JSON,150,12838,96,1.5 hours
The Ultimate Web Developer How To Guide,200,24861,423,22.5 hours
Build A Complete CRUD Application With PHP, MYSQL & JQUERY,20,9762,94,13.5 hours
jQuery Crash Course: Learn the Essentials of jQuery Fast,50,11262,142,2 hours
Drupal Tutorial : Drupal 8 Beginner to Expert in 8 PROJECTS,200,1270,16,7 hours
The Complete PHP CodeIgniter Course: Beginner To Advanced,195,17895,212,4 hours
JavaScript For Beginners : Learn JavaScript From Scratch,195,11285,102,5.5 hours
Mastering 'Native CSS Shapes To Build Modern Web Pages",195,1040,5,3.5 hours
WordPress Development For Beginners,95,23572,210,2 hours
WordPress local server setup and site migration online,55,3801,43,1 hour
PHP Fundamentals - Start Earning The Top Dollars You Deserve,195,12068,81,1.5 hours
Interactive Dynamic JavaScript for beginners DOM,200,5559,35,2 hours
Javascript Intermediate level 1 - Mastering the DOM,100,1838,169,3 hours
Sublime Text for Rapid Web Development,20,2104,69,1 hour
Servlets and JSPs Tutorial: Learn Web Applications With Java,35,15187,970,10 hours
Projects in PHP and MySQL,60,10606,570,23 hours
PHP OOP: Object Oriented Programming for beginners + Project,200,6497,901,18 hours
React Redux React-Router: From Beginner to Paid Professional,20,11536,876,6.5 hours
Django Core | A Reference Guide to Core Django Concepts,195,16282,303,18.5 hours
Angular 2 Complete E-Commerce App Course - Java,Spring,MySQL,195,949,129,20.5 hours
Build An Online Bank With Java, Angular 2, Spring and More,195,1995,286,6.5 hours
The Complete jQuery Course: From Beginner To Advanced!,195,6636,302,6 hours
Projects in AngularJS - Learn by building 10 Projects,40,7146,629,14.5 hours
The Ultimate Vue JS 2 Developers Course,195,1703,292,13 hours
React JS - Build real world JS apps & deploy on cloud,175,12815,262,8.5 hours
Angular 4 Front To Back,40,44,0,8.5 hours
Modern Web Development with SASS, Gulp, NPM & Web Workflows,95,502,62,5 hours
HTML5, CSS3 And JavaScript Fundamentals 2016,115,627,125,1 hour
Angular 4 - Concepts, Code and Collective Wisdom,50,851,164,4.5 hours
Learn E-Commerce Website in PHP & MySQL From Scratch!,Free,29990,1342,17.5 hours
JavaScript Game Development: Create Your Own Breakout Game,Free,10179,314,1.5 hours
HTML and HTML5 For Beginners 2016,200,563,178,3 hours
A Very Complete Introduction To Laravel,20,2320,114,6 hours
Learn to code, Become a Web Developer and Master JavaScript!,200,2353,47,10 hours
Serverless Architecture on Amazon Web Services,Free,13210,978,33 mins
jQuery Essentials: Learn the Fundamental of jQuery,20,1004,43,3.5 hours
Expert Guide : Mastering Functions in JavaScript !,195,3015,30,2.5 hours
Learn Angular 4 from Scratch,Free,8693,522,1.5 hours
Discover HTML Essential guide to HTML how to create webpages,85,8711,44,1.5 hours
HTML5 and CSS3 for beginners: Create a Website from Scratch,200,9945,101,2 hours
Introduction to Web Development,20,18143,159,2 hours
jQuery Fundamentals Powerful Bootcamp for beginners,150,13882,63,3 hours
The Complete HTML & CSS Course - From Novice To Professional,195,57422,874,7.5 hours
JavaScript Basics Web Development Building Blocks,95,10179,68,1.5 hours
Bootstrap unleash the power faster & easier web development,150,18101,88,5.5 hours
JavaScript Design Patterns: 20 Patterns for Expert Code,95,2789,243,3.5 hours
Fix Google's New 'Not Secure' Warning with Let's Encrypt!,95,1437,24,1 hour
JavaScript for Beginners Welcome to learning JavaScript,50,10864,63,2 hours
Benefits of Thinking Mobile First Future of Website Design,75,14254,27,1.5 hours
Javascript from Beginner to Advanced Level,195,6134,160,6.5 hours
AJAX Development,20,7867,147,3 hours
Interaction Design Specialist For Web Developers,95,8594,37,2 hours
PHP Security,50,1892,147,2.5 hours
The Bubble Course - Create Complete Web Apps without Coding,30,3960,220,4.5 hours
The Complete HTML5 & CSS3 Course Build Professional Websites,195,10518,129,4.5 hours
CSS Web Development Crash Course,20,10008,53,2.5 hours
Mastering DevOps,100,1023,118,6 hours
Building Websites Create a fully functional Web contact form,200,3392,29,1.5 hours
Create a Dynamic User Registration Form from scratch,100,7213,50,3 hours
A 13 Hour SQL Server 2014 /ASP.NET/CSS/C#/jQuery Course,35,4183,231,14 hours
HTML Workshop,20,25854,306,2 hours
Python for Beginners: Python Programming Language | Tutorial,150,6153,125,5 hours
Creating Animations using HTML5 Canvas,25,4010,17,1 hour
Bootstrap 4: Exploring New Features,75,5022,38,1 hour
Bootstrap 3 -> Profitable WordPress Theme Development!,40,5547,80,3.5 hours
Intro to Git,20,2532,291,1 hour
WordPress Domination #2: Leads & Scarcity,95,2362,4,1 hour
Learn How to Manage & Customize  Web Sites By Drupal CMS,140,7741,9,2.5 hours
Using Modern JavaScript Today,50,1658,185,16.5 hours
Up and Running with jQuery,Free,3324,138,5 hours
Learn How To Build A Professional Web Site By Using Joomla,70,7184,22,4 hours
Power up HTML5 with JavaScript,100,4442,23,2 hours
Node Package Manager Course: Build and Publish NPM Modules,30,7196,8,6.5 hours
WordPress Look and Feel with Themes,25,2371,10,1 hour
PHP with Laravel for beginners - Become a Master in Laravel,150,8496,1838,29.5 hours
JavaScript 2017: Become Top Rated Web Developer,115,1346,330,3 hours
The Complete Web Developer Bootcamp - Beginner to Expert,190,14103,1548,21.5 hours
Full-Stack Web Apps with Meteor and React,85,3295,531,31.5 hours
Angular 4: From Theory to Practice & FREE E-Book,200,4375,622,15.5 hours
The Complete Sass & SCSS Course: From Beginner to Advanced,195,12021,660,4 hours
Become a Certified Web Developer,100,26673,1090,12 hours
Become a Web Developer from Scratch,120,69186,2408,27.5 hours
Ultimate Angular 4 (previously Angular 2) with Bootstrap 4,50,11384,1846,5.5 hours
The Ultimate Beginner's Guide to Django,200,2390,497,9 hours
React JS - Mastering Redux,100,7059,116,5 hours
Professional Ruby on Rails Developer with Rails 5,200,3179,214,20.5 hours
Ruby on Rails 5 - BDD, RSpec and Capybara,200,1870,193,14.5 hours
Back to School Web Development and Programming Bundle,200,18170,117,44.5 hours
Complete ASP NET MVC Web Development - Newbie to Ninja!,195,6073,627,9 hours
The Complete DevOps Engineer Course 2.0 - Java & Kubernetes,195,5335,105,14 hours
All about NodeJS,50,8755,931,15.5 hours
How To Create A Wordpress Website 2016 | NEW Divi Theme 3.0!,40,4144,383,5.5 hours
The Complete jQuery Course - From Beginner to Professional!,200,6420,134,22.5 hours
Build a complete Fiverr clone with Node + Algolia + Paypal,30,1741,26,9 hours
The Ultimate Web Development Course,50,9881,329,12 hours
React From The Ground Up,150,3252,401,12.5 hours
Javascript for Beginners Learn by Doing Practical Exercises,100,5089,685,3.5 hours
8 Beautiful Ruby on Rails Apps in 30 Days & TDD - Immersive ,100,5962,466,16 hours
Wordpress Website Mastery 2017,Free,5181,64,2.5 hours
How To Make an eCommerce Website With Wordpress 2017,Free,3493,43,4.5 hours
Mastering ASP.NET MVC 5 From Scratch Using C#,50,417,65,13 hours
Start Web Development with GIS Map in JavaScript,60,1599,26,3 hours
Learn to Build Websites using Twitter Bootstrap,Free,15134,523,2.5 hours
Web Development Tools the Pros Use: Code Productivity Hacks,30,2596,11,4 hours
WordPress : An Overview,45,1783,16,36 mins
Create Startup Landing Page with Viral Marketing Strategies,Free,12974,120,1 hour
JavaScript : JavaScript Awesomeness,25,785,20,1 hour
Mastering CSS 3.0 Selectors,Free,4115,63,2 hours
WordPress Backup And Restore Fundamentals,Free,13242,131,1 hour
Learn HTML and CSS to make a Website,20,1154,12,6 hours
1 Hour HTML,200,16212,514,1 hour
Angular 2 Crash Course with TypeScript,100,16409,589,4 hours
Boost your website speed without any coding!,50,1337,28,1 hour
Professional Rails Code Along,40,1469,237,19 hours
ASP.NET Web API 2 Hands-On,20,2660,276,1.5 hours
Create a MEAN App by Example - Full Stack Course,50,421,26,3.5 hours
The Original Complete Web Developer Course.,20,31070,742,18 hours
Angular 2 From The Ground Up,30,1737,471,11.5 hours
Complete Web Development Course + Building 5 Websites!,200,11492,174,24.5 hours
WP Plugin Development - Build your own plugin!,200,5439,22,4 hours
Sass: From Beginner to Advanced,40,8059,231,2 hours
Build Flat Responsive Website from Scratch - Complete Course,35,12105,144,7.5 hours
Wordpress for Beginners - Build a Live Website from Scratch,20,3877,92,1.5 hours
Essential JavaScript, jQuery and AngularJS Training,30,2919,136,7 hours
The Pro Ruby on Rails Starter,45,2409,90,2.5 hours
Unit Testing AngularJS: Build Bugfree Apps That Always Work!,25,2083,213,2.5 hours
WordPress Blog : Create a WordPress Website for Beginners,20,2076,8,2 hours
Introduction to HTML5 Canvas basics of drawing,200,2918,16,1 hour
Thoughtful Web Development Course: HTML, Vue.js, PHP, MySQL,200,842,144,25 hours
Kids Coding - Beginners CSS,100,7130,30,1 hour
PHP & MySQL - Learn The Easy Way. Master PHP & MySQL Quickly,50,5549,92,15.5 hours
Learning Path: Magento: Master and Test Magento 2 with Ease,200,155,9,6 hours
The Complete hapiJS Course - Go From Beginner To Advanced!,195,1697,64,6 hours
Ruby On Rails For Web Development,195,2526,185,5 hours
Create eye-catching WordPress website from scratch,30,2342,15,4.5 hours
Become A Web Developer And Seller - Build Websites With HTML,200,21730,61,2.5 hours
WordPress Tips and Tricks,200,1117,10,2.5 hours
HTML Tutorials : HTML Code for Website Creating,20,2401,15,3 hours
Complete HTML5 and CSS3 Course +1 Start to Finish Project,200,3887,81,8.5 hours
Web Development With HTML CSS BOOTSTRAP JQUERY for Beginners,35,1156,4,5 hours
HTML5 Specialist: Comprehensive HTML5 Training,100,1385,188,5 hours
CSS and CSS3 For Absolute Beginners,75,10890,212,5 hours
Build a Complete JQuery Plugin (Image Pop-up Dialog),20,1126,10,1 hour
How to create HTML Forms,30,3652,60,40 mins
ReactJS and Flux: Learn By Building 10 Projects,60,1723,258,11 hours
How To Make A Business Website In 1 Day With Wix FAST & EASY,20,3759,24,4 hours
PHP Date and Time Course by Edwin Diaz,40,1653,53,1.5 hours
Start Your Own Forum Website in 15 Minutes ,40,5387,38,1 hour
Hit the ground running with AngularJS with Dion Yang,100,4563,49,1.5 hours
Learn CSS Transition and Animation ,100,3757,28,1 hour
Learn JavaScript from scratch,20,4193,92,2.5 hours
WordPress for Beginners - Tutorial - From Novice to Know-How,20,3694,48,4 hours
RESTful API with Laravel,45,1905,228,6 hours
Learn Ruby on Rails for Absolute Beginners,195,2875,20,4.5 hours
JavaScript Tutorial,180,613,93,4.5 hours
Shopping Cart Website from Scratch Ecommerce,200,633,39,4 hours
Learn By Example: Angular JS,50,1515,32,7 hours
The Complete front end web developer Bootcamp - 14 projects,200,900,129,18.5 hours
WordPress LMS: E-Learning Website Made Easy,20,2382,22,1.5 hours
Create An HTML5 Video Player From Scratch,Free,32260,1005,1.5 hours
In Depth Web Development Made Easy,25,3249,27,6.5 hours
Jquery :basics for beginners,50,1274,34,40 mins
Web Development By Doing: HTML / CSS From Scratch,Free,72932,2575,1 hour
Build Your First Website in 1 Week with HTML5 and CSS3,Free,120291,5924,3 hours
ASP.NET Core MVC, Quick and Practical,20,387,5,2.5 hours
Better way towards CSS using Less and Sass,20,2227,44,1.5 hours
JavaScript Complete for beginners with real world Apps,120,2652,33,3.5 hours
Creating a Responsive HTML Email,20,2520,183,1.5 hours
Angular 2 Demystified,20,3150,69,3.5 hours
Learn HTML Fast and Easy!,20,4011,24,1.5 hours
How To Setup a Micro-Blog in 3 Easy Steps,25,6937,22,1 hour
Ruby on Rails for Complete Beginners,35,4839,129,4 hours
Wordpress for Non-Technical People,150,2346,10,4.5 hours
ASP NET CORE - ANGULAR 2 E-Commerce App,200,897,129,13 hours
Introductory JavaScript Made Easy Training Tutorial,20,9381,138,11 hours
Become a Heroku Rails Ninja: Expert Level Deployment Tools,50,7090,52,8.5 hours
Complete RESPONSIVE Website Design with HTML5 & CSS3,20,2204,6,9 hours
Pimcore Developer: Implement a Blog from a Bootstrap Theme,95,1212,15,4.5 hours
Inspirational Web Development - A Beginner Approach -,20,5328,47,3.5 hours
Learn HTML, A practical guide from scratch to HTML 5,100,5715,52,3 hours
JavaScript Tutorial: Learn JavaScript Code for Beginners,20,2074,14,1.5 hours
Website Secrets: Get a Gorgeous Website on the Cheap,50,12328,15,2 hours
Ultimate WordPress Plugin Course,100,4537,415,9 hours
PHP for Beginners: How to Build an E-Commerce Store,100,5117,463,14.5 hours
Build Realtime Apps | React Js, Golang & RethinkDB,60,3854,482,3 hours
Master Electron: Desktop Apps using HTML, JavaScript & CSS,165,1902,224,5.5 hours
The Complete Web Developer Masterclass: Beginner To Advanced,195,37141,1813,51 hours
Mastering Micro Services Using Java Spring Boot,195,1649,34,2 hours
How to Create A Website: An HTML Tutorial and CSS Tutorial,65,3012,260,32.5 hours
The Advanced Web Developer Course,100,6890,99,10.5 hours
Projects in MongoDB - Learn MongoDB Building Projects,50,4628,247,12 hours
Learning JavaScript Programming Tutorial. A Definitive Guide,50,17113,380,9.5 hours
The Complete JavaScript, HTML and CSS Tutorial For Beginners,35,244,44,3 hours
Build Modern Responsive Website With HTML5, CSS3 & Bootstrap,195,1472,210,13 hours
The Complete JavaScript Course For Web Development Beginners,195,31499,450,4 hours
Email Marketing: Send Unlimited Emails via Own Mail Server,35,3539,43,1 hour
Getting started with JavaScript,200,1415,17,1.5 hours
Learn the basics of the Web development: Coding Tactics,40,2965,17,2 hours
RESTful API with Laravel 5.4: Definitive Guide,145,655,95,12.5 hours
Learn AngularJS Step By Step,20,18777,1112,1.5 hours
Learn React : The World's Most Lucrative JavaScript Library,50,1591,99,9.5 hours
Master Regular Expressions from scratch - All languages,70,1925,27,2 hours
Try AngularJS: Beginner's Guide to Front End Web Development,50,16926,126,4.5 hours
JavaScript Step by Step how to apply it to your web pages,100,13406,78,1.5 hours
Explore JavaScript Beginners Guide to Coding JavaScript,200,5739,26,2.5 hours
Learn Web Scraping with Node.js,75,16731,137,1 hour
Getting Started with WordPress 2016,20,1613,21,1 hour
Learn HTML5 Programming From Scratch,Free,268923,8629,10.5 hours
Getting Started with LESS - Beginner Crash Course,25,1780,69,1.5 hours
Master ECMAScript 2015 (ES6),Free,7438,441,2.5 hours
Learn to Setup Websites from Scratch,Free,21087,154,3.5 hours
Create Fast RESTful APIs with Lumen and Homestead by Laravel,60,1157,105,3 hours
Build Modern Websites Quick With HTML,CSS and Bootstrap,20,912,17,4.5 hours
Twitter Integration customize Tweets with developer API,115,2039,7,1 hour
Build a Responsive Website with a Modern Flat Design,Free,16527,354,2 hours
The Ultimate WordPress Boot Camp: Build 7 Websites,125,1000,74,11 hours
Master the Basics of HTML5 & CSS3: Beginner Web Development,Free,26541,750,3 hours
Become A Full Stack Web Developer in 14 Days,195,467,20,13.5 hours
Projects In ReactJS - The Complete React Learning Course,50,947,108,8 hours
Beginning Web development Learn the basics of HTML,95,9832,71,2 hours
Step by Step Build Your Template by Bootstrap 4 from scratch,80,2184,15,3 hours
Hosting your static website on Amazon AWS S3 service,20,2853,47,1.5 hours
JavaScript Rockstar How to create Incredible Useful code,75,16590,51,2.5 hours
Spring Core DevOps on AWS,100,1626,115,6.5 hours
How to Create a Website Without Coding - WordPress 2016,195,9056,96,1.5 hours
PHP Graphic Techniques: CAPTCHA/ Create a verification code,20,8320,73,43 mins
Introductory To HTML and CSS,50,4106,112,1 hour
Learn how to convert PSD to HTML and CSS responsive,30,5324,52,2.5 hours
PHP User Login Registration Script With All Features,200,5603,46,4 hours
AJAX : Let's build a COOL project,70,4183,292,3.5 hours
Advanced WordPress Topics: Post Types Taxonomies & Metaboxes,95,301,44,7.5 hours
Laravel Homestead,Free,3883,110,1 hour
The Complete TypeScript Programming Guide for Web Developers,40,236,31,4 hours
JavaScript with BackboneJS and Bootstrap CSS - Advanced,25,1758,37,3.5 hours
