Title,Price,Subscriber Count,Number of Reviews,Course Length
CSS :basics for beginners,30,1085,8,32 mins
WordPress Development - Themes, Plugins & Single Page Apps,150,817,164,19.5 hours
Learn Effective HTML in No Time!,40,1275,11,1 hour
HTML5 Geolocation in Depth:Build 7 HTML5 Geolocation Apps,90,1526,72,6.5 hours
Building a Search Engine in PHP & MySQL,Free,10110,379,2.5 hours
create a search engine for your website!,20,1832,6,1.5 hours
Learn basics of HTML in 30 Minutes,20,945,17,33 mins
JavaScript from Scratch for Very Beginners,30,1272,31,5 hours
Learn Web Development by Creating a Social Network,200,442,48,6.5 hours
CSS Image filters - The modern web images color manipulation,Free,6315,53,1.5 hours
Building Responsive Websites with Bootstrap 3 Framework,75,1322,14,3 hours
Create a Membership Site with Wishlist Member & Wordpress,95,557,39,2.5 hours
Convert HTML Websites into PHP: Learn by Doing in 40 Minutes,50,540,13,36 mins
17 Complete JavaScript   projects explained step by step,185,327,26,9.5 hours
Mastering Unix : AWK Commands,20,358,0,2 hours
Cakephp:Creating a CRUD application,40,803,2,31 mins
HTML and CSS: A Guide to Web Design,25,1557,13,14 hours
Drupal 8 Site Building,Free,1942,23,4.5 hours
Learn Bootstrap 4 The Most Popular HTML5 CSS3 & JS Framework,200,279,37,10 hours
Essentials of Spring 5.0 for Developers,125,34,2,1.5 hours
The Extreme Web Development Course - For Beginners,200,1420,62,5.5 hours
JQuery DOM and Ajax Concept Explained for Beginners,35,1812,112,37 mins
HTML Forms For Beginners: A Basic Introduction  ,45,2472,41,1 hour
Ultimate JavaScript Objects,20,1525,43,2.5 hours
The Complete Web Developer Course - Build 20 Websites,20,2650,61,15.5 hours
Simple Javascript: Learn by Doing, Beginners Welcome!,25,2753,10,2 hours
Learn HTML, CSS, and Ruby on Rails: Build Your First Blog,20,2985,40,1.5 hours
Learn HTML5 Canvas for beginners,100,2360,12,3.5 hours
Bootstrap 4 Beginners: Code a Responsive Landing Page,30,948,193,3.5 hours
Build Wordpress CMS Clone with Laravel 5,150,392,81,8.5 hours
XML DTD - Crash Course for Beginners,45,944,1,1 hour
Beginner Photoshop to HTML5 and CSS3,Free,73110,1716,2 hours
XPATH :basics for beginners,40,878,6,37 mins
The Fastest Way to Create a Website Using Godaddy,30,1454,14,30 mins
A how to guide in HTML,Free,7318,205,35 mins
Building Better APIs with GraphQL,50,555,89,2.5 hours
Learn Grunt with Examples: Automate Your Front End Workflow,20,496,113,1 hour
Build A Stock Downloader With Visual Studio 2015 And C#,20,436,36,1.5 hours
jQuery UI in Action: Build 5 jQuery UI Projects,150,382,28,15.5 hours
Learn jQuery from Scratch - Master of JavaScript library,100,1040,14,2 hours
How To Design A WordPress Website With No Coding At All,25,306,3,3.5 hours
Learn and Build using Polymer,40,513,169,3.5 hours
CSS Animations: Create Amazing Effects on Your Website,50,300,31,3 hours
Using MODX CMS to Build Websites: A Beginner's Guide,45,901,36,2 hours
