Title,Price,Subscriber Count,Number of Reviews,Course Length
Dive Into Docker: The Docker Course for Developers,Free,6437,313,1.5 hours
Basic Concepts of Web Development, HTTP and Java Servlets,35,2797,59,1 hour
The Most Comprehensive Web Development Course,200,333,22,42 hours
Learn and Understand AngularJS,175,59361,11580,7 hours
JavaScript: Understanding the Weird Parts,175,79612,16976,11.5 hours
Webpack 2: The Complete Developer's Guide,75,8964,1893,5.5 hours
Build Responsive Real World Websites with HTML5 and CSS3,195,43977,7106,12 hours
ES6 Javascript: The Complete Developer's Guide,80,13010,2709,6.5 hours
Learn and Understand NodeJS,195,58208,11123,13 hours
Understanding TypeScript,110,9132,1560,7 hours
Advanced React and Redux,140,21998,3326,12 hours
Modern React with Redux,180,50815,15117,26.5 hours
Angular Styling & Animations (for Angular 2 and Angular 4),120,4138,307,6 hours
The Complete ASP.NET MVC 5 Course,190,20652,6357,7.5 hours
GraphQL with React: The Complete Developers Guide,150,6412,987,13 hours
Create a Simple Photo Gallery with Dropzonejs, Slick and PHP,Free,2464,17,44 mins
WordPress in under an hour - Create/manage your own website!,Free,6474,86,1 hour
Twitter Bootstrap 2 for Beginners,20,2388,139,1 hour
Bootstrap Tutorial - Essentials From Basic to Advanced,195,1494,23,7.5 hours
Create an Engaging Website with Twitter Bootstrap 2.x,20,1463,56,1 hour
Javascript :basics for beginners,30,1057,22,37 mins
CSS Tutorial For Beginners: Style Your Wordpress Templates,35,1049,22,3.5 hours
HTML5 And CSS3 - Build Modern Responsive Websites,175,109,17,9.5 hours
PSD to HTML5/CSS3 using Twitter Bootstrap 3! ,95,2073,24,2 hours
Web Development: Make A Website That Will Sell For Thousands,50,1116,62,7.5 hours
WordPress Basics to Business: Share and Sell your Expertise,50,1125,10,3.5 hours
PHP Zend Framework 2:Creating a CRUD Application,40,802,6,38 mins
JavaScript Fundamentals,Free,4409,71,5 hours
Building a Website With Jekyll,20,686,19,3 hours
Big Data and Apache Hadoop for Developers - Fundamentals,30,1154,89,3 hours
Wordpress Development : Create a Custom Wordpress Website,120,885,3,1.5 hours
How to Make a Wordpress Website 2017,Free,2437,137,34 mins
RESTful Services with ASP.NET Web API,85,716,59,2 hours
Web Hosting Fundamentals,20,1867,19,37 mins
Learning Path: React: Make Stunning React Websites,200,91,5,6.5 hours
Administering Microsoft SQL Server 2012 Databases - 70-462,60,586,65,5.5 hours
PHP CodeIgniter:CRUD concepts in MVC,40,601,4,35 mins
Adobe Experience Manager CMS Basics,35,81,14,1 hour
Introduction to Frontend Web Development For  Beginners,145,1018,28,4.5 hours
PHP: Complete Login and Registration System with PHP & MYSQL,200,1448,173,7.5 hours
JavaScript Complete Guide to learning JavaScript,200,1296,22,5.5 hours
Advanced Scalable Python Web Development Using Flask,120,1299,56,14 hours
jQuery for Absolute Beginners - Lite,20,1769,49,35 mins
HTML Complete Course - Beginner to Expert,Free,20073,615,1.5 hours
Cross-Platform Development with ASP.NET Core 1.0 MVC,35,601,126,5.5 hours
Build a Photo Blog with Ruby on Rails,20,2281,32,1.5 hours
Practical PHP: Master the Basics and Code Dynamic Websites,Free,83737,4598,6.5 hours
Sass Workflow,Free,20890,945,3 hours
Learn PHP Fundamentals From Scratch,Free,48650,1236,2 hours
XML For Absolute Beginners: Learn to create your own tags,75,1945,58,1 hour
Joomla: Create a Joomla Website This Weekend With NO CODING!,Free,18496,386,2 hours
JavaScript for beginners - A Complete Guide,100,1193,87,10.5 hours
Laravel Deployment - Launch your Laravel Application Online,Free,4905,101,1 hour
WordPress Development Crash Course: From Zero To Hero,60,1699,8,2 hours
Learn how to create a WordPress theme using Pinegrow,Free,11812,152,2 hours
Learn to Build Web Apps using Laravel Framework,30,746,93,6.5 hours
Flexbox: The complete guide,35,189,7,1 hour
How to Safely Copy and Move Your WordPress Website,60,1419,38,1.5 hours
AngularJs :basics for beginners,45,1237,16,1 hour
JSON For Beginners: A Very Basic Introduction,65,1703,27,1 hour
Learn SASS and improve your CSS,55,1849,29,3 hours
Angular Tutorial For Beginners,Free,5397,112,2.5 hours
HTML and CSS for Absolute Beginners,Free,4410,52,3 hours
JavaScript, jQuery and Ajax,20,1554,30,4 hours
Laravel Blog Development Starter,Free,4499,138,2 hours
React: Learn ReactJS Fundamentals for Front-End Developers,55,1993,55,4 hours
JavaScript For Absolute Beginners - Level Two,30,424,85,1 hour
How To Create A Real Estate Website With Wordpress 2017,Free,3782,32,1.5 hours
The Complete HTML5 and CSS3 Course - with 8 Websites Design,30,1551,42,7.5 hours
Introduction to Modern Programming with PHP,20,954,183,16 hours
HTML Introduction Course: Learn HTML in 2 hours!!!,Free,7304,368,2 hours
Learn HTML & CSS: How To Start Your Web Development Career,Free,15462,689,4.5 hours
React vs Angular vs Vue.js by Example,Free,6958,132,3.5 hours
Create WordPress Plugins,50,964,19,2.5 hours
Build and Deploy a LAMP server on AWS,Free,3571,18,1 hour
Build your own Beautiful Blog in WordPress + SEO,200,2421,6,3 hours
AngularJS Authentication: Secure Your App with Auth0,Free,21689,1080,1 hour
Learn Bootstrap 4 by Example,Free,5542,54,1 hour
Complete WooCommerce Plugin Tutorial For Wordpress 2017,Free,7922,183,1.5 hours
How To Build And Make A Wordpress Website From Scratch 2017,Free,7055,166,2 hours
Docker for Developers - Newest Version 1.12 with Swarm Mode,95,767,104,5.5 hours
Angular Material - Quickstart,Free,3766,135,42 mins
HTML and CSS for Beginners - Build a Website & Launch ONLINE,Free,70773,5660,6 hours
Core: A Web App Reference Guide for Django, Python, and More,195,2497,98,26 hours
JSON with Java APIs, jQuery and JSON REST Web Services,95,799,87,6 hours
Bootstrap 4 Quick Start: Code Modern Responsive Websites,Free,41478,2104,3 hours
Learn Symfony 3 framework by practical examples,125,867,177,4 hours
Complete Web Development with HTML, CSS and Javascript,Free,2097,16,2 hours
Web Hosting Introduction: How to Publish Your Website Online,Free,5533,137,1 hour
Django For Beginners,175,534,16,4 hours
Introduction to QGIS Python Programming,85,197,26,3.5 hours
Learning Object-Oriented JavaScript,75,533,54,3 hours
Bootstrap Tutorial for Beginners,20,1036,27,2 hours
Learn Bootstrap3 With Multi Purposes Single Page Layout,Free,4503,146,21 hours
HTML for Beginners,Free,8592,336,2.5 hours
How to Build WordPress Themes: A Web Designer's Guide,165,183,30,5.5 hours
XML DTD :basics for beginners,35,903,3,33 mins
Learn to make an HTML 5 website with a video background,80,1236,18,30 mins
Learn Authentication With ASP.NET Identity Security 2017,50,305,45,2 hours
HTML and CSS Foundations,Free,1544,15,1 hour
Python Web Programming,100,1020,46,6 hours
Build a Complete Registration and Login System using PHP MVC,80,325,50,5 hours
ES6 / EcmaScript 6 for beginners an introduction,Free,3227,19,2 hours
React for visual learners,20,659,64,3.5 hours
Learn to Create Advance Responsive Websites With Bootstrap,20,2528,15,2 hours
Master the Art of Web Design with HTML & CSS,145,550,15,3 hours
Sell Courses On Your Own Website - No Coding Required!,100,1032,9,1 hour
Implementing a Data Warehouse with SQL Server 2012 ,85,1142,148,5 hours
Learning 200 jQuery Functions with 800 Examples,195,1766,38,18.5 hours
Create Complete Web Applications easily with APEX 5,30,912,128,7 hours
Learn Gulp, The Streaming Build System,25,1305,38,1.5 hours
Perfect React JS Course - Understand Relevant Details,200,653,20,1 hour
Create a classified website in 2 hours - guaranteed,50,3411,84,1 hour
Learn HTML And CSS From Scratch,Free,11533,240,2 hours
Become a Certified Web Developer - Beginner to Expert,200,3397,12,8 hours
Complete Bootstrap 4 course - build 3 projects,Free,7865,241,5 hours
Up and Running with Phalcon,20,715,12,1.5 hours
HTML : HTML Awesomeness,25,988,23,38 mins
Build CRUD Application - PHP & Mysql,Free,4405,71,1.5 hours
All You Need To Know About AngularJS - Training On AngularJS,50,1936,88,5 hours
PSD To a Creative Landing Page Using Twitter Bootstrap 3,Free,11666,546,4 hours
Ready for Production with Spring Boot Actuator,55,361,26,2.5 hours
AngularJS For Beginners,Free,30531,1948,3 hours
Learning Path: Akka: Building Applications and Microservices,200,88,8,4.5 hours
Set up a localhost Web Server for Faster Website Development,30,55,13,1.5 hours
Mastering Meteor: Reactive Full Stack JavaScript,95,494,46,3 hours
Build A Professional Wordpress Website In An Hour,20,1294,11,1 hour
Build a file hosting/sharing site in less than 2 hours ,20,976,29,1.5 hours
Introduction to Java Programming for Online Learners,200,1586,87,22 hours
Create full featured Landing Page in Ruby on Rails in 3 hour,30,1550,15,3 hours
How to create a  video blog with WordPress,25,1209,8,4.5 hours
PHP For WordPress Development,35,850,12,1 hour
Create a Professional Website Without Programming/Coding,Free,5421,93,1.5 hours
How to Build an Autocomplete System Like Google,30,255,5,1 hour
Master EmberJS : Learn Ember JS From Scratch,120,707,59,6.5 hours
How To Make A Modern Wordpress BLOG 2017! Create Your Blog!,Free,6856,137,2 hours
Learn Top Ten PHP FrameWorks By Building Projects,60,1007,96,17.5 hours
How to Make a Video Blog Website From Scratch w/ Wordpress ,Free,12952,163,1 hour
Build Websites And Apps By Outsourcing,20,2299,11,2 hours
Learning Path: Web Applications with Spring and Angular,200,19,2,4 hours
Learn Ruby on Rails By Building Projects,60,1736,79,13 hours
Canvas image Creator HTML5 JavaScript project from Scratch,100,2195,10,3.5 hours
Javascript Essentials,Free,47062,5590,8.5 hours
Devtools 2017: The Basics of Chrome Developer Tools,Free,4569,108,1 hour
Chrome Extensions : Develop 5 chrome extensions from scratch,Free,3655,85,2 hours
Learn how to quickly build websites using Wordpress,Free,15715,406,3.5 hours
Advance Unix : File Processing: AWK | SED | GREP | CUT | VIM,75,578,40,5.5 hours
Develop a Professional OnePage WordPress site With No Coding,20,1747,13,1.5 hours
PHP Specialist (2017 Edition),100,197,11,3.5 hours
Python Programming: Create an Digital Marketplace in Django,195,4198,145,26 hours
Create Ajax Chat App with PHP & Mysql,45,540,11,1 hour
Mastering Thymeleaf with Spring,75,942,161,4.5 hours
Learn Rails Programming in Less than 2 Hours,35,2470,24,2.5 hours
Wordpress Backup & Restore,95,478,37,1.5 hours
Learn JavaScript Dynamic Interactive Projects for Beginners,100,2558,12,3 hours
Build Modern Websites Super Fast,25,2178,22,1.5 hours
SAP - Learn SAPUI5 Professional Development,195,860,201,7 hours
Wordpress Security,95,2888,26,2.5 hours
Learn HTML5 At Your Own Pace. Ideal for Beginners,50,3026,60,7 hours
Build an Amazon clone: Nodejs + MongoDB + Stripe Payment,20,2164,290,8.5 hours
Build Real World Websites from Scratch using HTML5 and CSS3,195,10874,114,7.5 hours
How to become an App Developer,200,1935,17,1 hour
Modern JavaScript: Building Real-World, Real-Time Apps,50,1871,154,13.5 hours
JavaScript Introduction to Object Oriented JavaScript,90,7789,59,1.5 hours
Core HTML How to get online quickly HTML to HTML5 ,90,10394,33,3.5 hours
Building Websites JavaScript and the DOM,120,17759,64,3 hours
Complete Login and Registration System in PHP and MYSQL,200,4714,149,4 hours
The Complete E-Commerce Web Developer Course 5.0,195,3209,58,12.5 hours
HTML5 canvas Bootcamp for beginners 25 easy steps,120,14118,30,2 hours
Advanced HTML5 Tutorial for Web Developers,50,11847,57,7.5 hours
Learn the Basics of Programming for Marketers,55,11339,43,3.5 hours
Css For Beginners,85,1156,13,2.5 hours
GRUNT js: Automate web development tasks and save your time,55,1534,33,1.5 hours
Mastering Web and Mobile Debugging Using Chrome Dev Tools,195,1102,12,2 hours
HTML : Beginner Guide to HTML writing,20,783,20,37 mins
Build Web Apps Using EmberJS: The Complete Course,40,627,126,4.5 hours
SharePoint 2013 Development using C# - Part I,50,891,101,8.5 hours
SAP Crystal Reports with ASP.Net (Step by step),Free,7484,304,1 hour
Building Responsive Data Visualizations with D3 JS,85,876,59,2 hours
Learn Rails Programming in Less than 30 Minute - Lite,20,1235,25,38 mins
SASS - Beginner Crash Course,25,1143,34,1 hour
Angular 2 Fundamentals for Web Developers,40,450,61,6 hours
Easily Learn Web Development With Drop & Drag: OptimizePress,20,1442,9,2 hours
XML XSLT - Crash Course for Beginners,45,426,4,1 hour
Create Your Own Successful Online School To Sell Courses,95,2814,14,2 hours
Flask Tutorial Step by Step,Free,4645,171,2 hours
Ruby on Rails a Beginners Guide ,Free,13130,346,6.5 hours
Mastering Basic CSS Selectors.,Free,3933,23,3 hours
Create a Website Similar to Facebook from Scratch!,25,2197,9,1.5 hours
Comprehensive TypeScript,125,1318,78,4.5 hours
Essential HTML, CSS & HTML5 Training,50,1553,35,5.5 hours
HTML 5 and CSS 3 - tricks and workarounds,80,2007,10,5.5 hours
How to Register a Domain, Set Up Hosting, and Edit Web Pages,45,1540,19,3 hours
WordPress Plugins Treasure Chest,25,1655,10,3 hours
Practical Understanding of PHP and MySQL,Free,12201,217,5.5 hours
AngularJS for Beginners, Single-Page Applications Made Easy,200,1284,46,1.5 hours
Building a Social Network in PHP & MySQL From Scratch,50,869,125,14 hours
XML DOM - Crash Course for Beginners,45,396,6,34 mins
Create a Powerful Website with the Cool Bootstrap Framework,Free,7142,41,4 hours
HTML5 and CSS3 -Start building beautiful websites,150,1414,14,2.5 hours
Getting Started as a Web Developer,Free,9833,241,1 hour
Learn Laravel: Create Your Web App Step-By-Step,45,604,47,4 hours
Professional Web Scraping with Java,50,685,37,1 hour
3D Programming with WebGL and Babylon.js for Beginners,200,549,49,2 hours
Learn to make a colorful one page website,200,1220,16,34 mins
WordPress Plugin Tutorial,40,1588,8,34 mins
Introduction to HTML,Free,8371,212,1.5 hours
Learn JavaScript From Scratch:Become Top Rated Web Developer,65,2570,17,5 hours
Installing Wordpress 4 - Installation, Registrars & Hosting,45,6117,188,2.5 hours
Learn PHP Programming for Absolute Beginners,35,5368,78,2 hours
WordPress for Beginners 2017 + Google AdSense Implementation,195,2225,14,6.5 hours
JavaScript for beginners in 1 hour,95,2086,56,1 hour
HTML5 and CSS for Beginner To Expert,20,1732,15,4.5 hours
Become a Kick-Ass Web Developer: From Newbie to Pro,200,6751,44,48.5 hours
Django Tutorial: Build Your First App Fast & Free! ,20,5228,180,2.5 hours
Create a social network using PHP Mysqli HTML Css and JQuery,40,1477,17,6 hours
PHP - Send and Receive Mobile Text Messages (SMS),50,1626,81,1.5 hours
Complete PHP Course with OOP Start to Finish!,200,4529,54,2 hours
Coding Made Easy: HTML & CSS For Beginners,40,3254,92,1.5 hours
WordPress Security - The Ultimate Security Guide,60,2267,17,1.5 hours
How to Make a Single Page Website for Freelancers & Agencies,Free,17463,283,1.5 hours
Learn to Use jQuery UI Widgets,Free,23669,521,1 hour
Learn to Create Responsive Layouts in 30 Minutes,Free,5301,174,30 mins
Web Building Starter Pack. Html Css and JQuery Animations,30,1033,16,7.5 hours
Getting Started with Angular 2+,Free,6909,401,2 hours
Intro to PHP Web Application Development with Symfony,200,4040,72,1.5 hours
Learn OAuth 2.0 - Theory and Hands On,145,546,69,3 hours
Learning CSS3 - A Comprehensive Tutorial For Web Developers,50,2459,107,8 hours
Professional WordPress Theme Development from Scratch,200,1284,173,25.5 hours
PHP Zend Framework 1.11:Creating a CRUD Application,40,1122,5,35 mins
Write quicker HTML5 and CSS 3; productivity hacks with emmet,Free,13016,286,1.5 hours
The Ultimate jQuery Course,20,1098,15,2.5 hours
Build an Advanced Single Page with Bootstrap & WordPress,95,481,75,6 hours
Master all PHP ideas 2017 to build any project,50,376,19,3 hours
A Beginner's Guide to the Meteor JavaScript Framework,50,898,132,2 hours
Create an E-commerce website without any coding,20,1393,40,31 mins
Learn To Build Apps Using Play Framework,40,434,69,5.5 hours
Introducing Ionic 2,50,394,78,1.5 hours
Learn Laravel with Database Migration & Seeding & Faker,20,263,14,1 hour
Create a Client Network by Hosting WordPress Sites,35,1061,8,1 hour
Introduction to PHP Slim Microframework,20,1312,19,1 hour
ASP :basics for beginners,35,764,7,1 hour
WordPress Development With NodeJS, Gulp, Composer & More,25,289,30,4 hours
Become PHP Facebook Developer: Password-Less Authentication,195,4001,8,4 hours
How To Create Your Very First Website With HTML and CSS,100,5097,196,2 hours
Learn JSON for beginners with JavaScript,200,3193,10,1.5 hours
Ultimate guide to Social Media Web development integration ,200,11011,13,2.5 hours
A Complete Laravel basics from beginner to expert,25,3492,61,1.5 hours
JQuery Basics - Learn JQuery From Scratch,100,3559,24,1 hour
Learn MeteorJS By Building 10 Real World Projects,50,2784,221,15 hours
JavaScript Basics for Beginners Introduction to coding,150,5495,52,1.5 hours
AngularJS Masterclass - Deep Dive & Understand AngularJS,100,2912,309,6 hours
HTML5 for beginners,195,9687,59,5 hours
All in one HTML CSS and JQuery,20,3444,35,3 hours
Responsive Design with NEW Materialize,75,12629,88,1.5 hours
Create a Responsive Business Website with WordPress,95,1659,73,5.5 hours
PHP webservices,30,1305,25,34 mins
JavaScript Promises: Applications in ES6 and AngularJS,75,651,52,2.5 hours
Learn to build 20 websites and build 14 iOS9 apps with swift,40,1926,9,22.5 hours
Professional CSS Flexbox,35,396,130,43 mins
XML :basics for beginners,40,1062,12,39 mins
How to create Paypal and Credit card Payment Buttons,65,578,6,1 hour
Customizr - Learn WordPress with the ultimate creative theme,Free,4735,81,5 hours
How To Create a Local Wordpress Environment,Free,4306,163,31 mins
Fun and creative web engineering with Python and Web2py,Free,10917,319,2 hours
WordPress for Beginners - Build Your First Website in 2017,100,1701,125,7 hours
Learn to Make an Animated Image Gallery using HTML5,Free,11080,165,1 hour
Projects in Foundation Framework - Learn By Building 10 Apps,50,636,33,10 hours
Drupal for Beginners,30,1478,18,5 hours
Laravel : CRUD Application Using AJAX In Laravel 5.3,20,362,19,1 hour
Foundations of Front-End Web Development,Free,8337,300,20.5 hours
Angular 2 - Superheroic Framework,20,702,21,3 hours
Social Network Web Development,200,2698,29,8 hours
For Free - Deploy Quickly Spring Boot on Heroku With MySQL,95,177,19,1 hour
Building Web Applications with Spring MVC,85,714,48,3 hours
HTML5, CSS3 & Bootstrap - How to Create a Responsive Website,20,1062,20,3.5 hours
HTML & CSS - Learn to build sleek websites ,55,1552,14,3.5 hours
Master Angular 2 - The No Nonsense Course,25,102,27,2.5 hours
Master ASP . NET 4 from scratch,50,613,135,16 hours
CoffeeScript: The Good Parts—Write Better javaScript,50,2152,19,2.5 hours
Mastering Magento,85,1063,101,3.5 hours
Ultimate JavaScript Strings,Free,3142,117,37 mins
Your Own Site in 45 Min: The Complete Wordpress Course,120,1566,29,4 hours
Redirect Your Visitors By Country Easily -Wordpress Tutorial,20,2306,3,1 hour
Learn Knockout JS Framework from GroundUp,40,633,104,5 hours
Build Responsive Websites  in an Hour using Portalfin,Free,2859,42,44 mins
Master Riot: Learn Riot.js from Scratch,125,299,75,3.5 hours
Learn W3.CSS,50,1002,7,34 mins
Learning Axure RP,75,631,103,4.5 hours
Complete guide to install Wordpress, PHP on Cloud,AWS or VPS,50,1386,17,3 hours
Kids Coding -Introduction to HTML, CSS and JavaScript,200,2355,143,7 hours
Introduction to Voice Design with Amazon's Alexa,Free,6742,1036,41 mins
How to Create a Social Network For a Niche-Related Community,100,1853,34,2 hours
Webpack 1 & 2 - The Complete Guide,40,252,46,6.5 hours
Star Rating Project AJAX with JSON response from PHP MySQL,120,1302,18,1.5 hours
Wordpress for beginners :Build Websites Fast without Coding ,50,1658,72,5 hours
ASP.Net MVC Quick Start,Free,15092,1234,5.5 hours
Build a Chatbot integrated Website using Bootstrap 4,50,165,13,3 hours
How To Create A WordPress Website Without Paying A Developer,20,4333,16,1 hour
PSD to Bootstrap 3 for Beginners using HTML & CSS,20,976,93,2.5 hours
Build Advanced Responsive Websites with Foundation 6 & SASS,200,1276,245,22.5 hours
Learn Essential Javascript Fundamentals - Lite,20,1476,27,39 mins
Learn HTML in 2 hours!,Free,5351,235,1.5 hours
Laravel 4 try and enjoy php coding,20,2402,26,2 hours
Wordpress Beginner Tutorial: Build Your First Website,Free,6402,104,1.5 hours
Build Complex Express Sites with Redis and Socket IO,125,223,26,3.5 hours
Building a ASP.NET MVC 5 Membership Website,95,654,86,25.5 hours
Drupal Views: Introduction to Enhancing Your Drupal Website,105,1262,36,2.5 hours
Bootstrap Bootcamp - Responsive web development- 8 projects,100,253,34,7 hours
Self Advertise Using PowerPoint Twitter and Facebook on ios,20,1780,15,36 mins
Learning Bootstrap 3 - Tutorial From Infinite Skills,50,1266,90,3 hours
Practical Web Development: Make Websites Quickly And Easily,20,2389,7,2 hours
Learn animation using CSS3, Javascript and HTML5,40,1468,54,2.5 hours
Creating Interactive HTML5 Video,25,838,13,2 hours
Optimizing Wordpress for More Speed and Revenue,Free,2649,16,35 mins
JavaScript project Learn to create a memory Game and more,95,6000,21,1.5 hours
The Complete JavaScript Bootcamp,195,1839,91,5 hours
JavaScript for Absolute Beginners,20,10689,394,2 hours
Complete JavaScript Course for Beginners with Easy Examples,200,7449,91,4 hours
Angular 2 Master Class with Alejandro Rangel,30,4157,206,9.5 hours
Quick learning jQuery web development,150,3388,67,3 hours
Google Blogger Course,60,1343,11,3.5 hours
Ajax in JavaScript and JQuery, with PHP - Creating Chat App,200,3399,85,1.5 hours
PHP Tutorial: Learn PHP Basic Programming for Beginners,20,2510,21,1.5 hours
Mastering Modern Web Development Using React,195,1537,8,2.5 hours
Full Stack JavaScript: Learn Backbone.js, Node.js & MongoDB,50,6134,93,2 hours
The Essential Web Developer Course - Build 12 Websites,200,9355,390,16.5 hours
Build Powerful Websites & Blogs using WordPress - No Coding,20,1024,14,3 hours
Learn to Build Web Apps using UnderscoreJS : Code Like a Pro,40,325,37,3.5 hours
Building Web Apps Using Flask and Neo4j,50,166,21,2.5 hours
Learn Web Animation the Easy Way: An Intro to SVG and GSAP,50,203,33,3 hours
Build Your Own Membership Website With Joomla,95,1134,9,1.5 hours
Learn Spring Security 4 Basics - Hands On,95,216,28,2 hours
Display and analyze GIS data on the web with Leaflet.js,100,25,4,12.5 hours
How to Build a CMS with PHP,50,1096,33,1 hour
Responsive Web Design with HTML5 and CSS3 - Introduction,35,770,65,8 hours
Master Typescript : Learn Typescript from scratch,95,424,45,3.5 hours
XSD :basics for beginners,35,755,0,42 mins
Angularjs-WebApi2-EFCodeFirst Web App On 3-Tier Architecture,60,652,48,6.5 hours
Css Positioning For Absolute Beginners: A Basic Introduction,65,4797,97,1 hour
Creating User Authentication System in CodeIgniter,200,2783,9,1.5 hours
How to easily Manage your WordPress Website,20,8462,50,2 hours
Wordpress For Beginners: Create a Professional Website,200,5129,183,1.5 hours
Building a Portfolio in 90 minutes ( HTML, CSS, Js ) ,20,5272,111,2 hours
Automate Web Development With Gulp JS,20,2784,425,3.5 hours
Bootstrap 4 Responsive Web Design and Development,20,3086,17,7.5 hours
Intro To HTML & CSS: Web Development For Beginners,20,6008,203,4 hours
Become Exceptional in HTML and HTML5,20,16486,86,6.5 hours
Become a Rockstar Web Developer - Learn By Coding,200,2076,125,11 hours
Spring 4 Mastercourse: Covers Annotation & XML Configuration,200,1353,53,23.5 hours
WordPress Plugin Development for 2017 - Build 14 Plugins,50,3770,108,7 hours
Single Page Application of MVC 5 Using AngularJS,20,722,53,1.5 hours
Learn to Code in HTML5, CSS3, and JavaScript,20,1404,7,2.5 hours
Web Application Development - Learn by Building 3 Web Apps,30,1688,16,1.5 hours
Rails Ecommerce App with HTML Template from Themeforest,25,214,34,2 hours
Writing CSS with {LESS} - Tutorial From Infinite Skills,50,788,21,2 hours
Login and Registration from Scratch with PHP and MySQL,20,1128,77,2 hours
Getting Started with Magento,85,608,88,3.5 hours
Ruby on Rails Foundations,20,359,45,6.5 hours
Core Concepts in HTML 5,75,1532,19,2 hours
Learn Azure Cloud Step by Step,20,791,29,2.5 hours
Learn Facebook Flux Architecture for Web Applications,40,395,26,6.5 hours
Create free, fast and secure static website,50,322,9,31 mins
Object Orientation in PHP,20,151,40,5 hours
Creating Custom Web Maps,50,208,48,2 hours
Build A YouTube Downloader With C# And GitHub,20,385,39,2.5 hours
Querying Microsoft SQL Server 2012 - (Exam No. 70-461),85,666,89,6.5 hours
HTTP Clients with Laravel: Use and Consume Services and APIs,65,237,22,3.5 hours
Modern E-Commerce Store In php & mysqli With Bootstrap,50,240,45,66.5 hours
Simple And Easy: Wordpress For Beginners,Free,5014,196,3 hours
Create Website from scratch in Urdu & Hindi,Free,3033,91,1 hour
Advance Unix : File Processing: AWK | GREP | VIM,20,458,2,1 hour
Introduction to Node.js Development,55,1779,48,1 hour
Advance JavaScript for Coders: Learn OOP in JavaScript,40,334,41,11.5 hours
Web Development With Google Maps,50,222,9,8.5 hours
jQuery UI Ultimate:Design Amazing Interfaces Using jQuery UI,145,422,86,12.5 hours
Learn Spring Security 4 Intermediate - Hands On,95,227,16,2 hours
Learning Path: The Road to Elasticsearch,200,50,5,5 hours
HTML/CSS Bootcamp,40,194,26,10 hours
JavaScript High Performance,95,458,28,4.5 hours
Node:js : Building Rest Apis with Sails.js,100,61,9,2 hours
Fundamentals of Angular 2 Full Stack Design,95,314,43,6.5 hours
Create Newsletter Subscription Form with PHP/AJAX in 40 Min,50,586,10,38 mins
AppML :basics for beginners,30,770,0,38 mins
How to manage your own VPS and create websites,120,735,16,1.5 hours
Learn BuddyPress: Build A Social Network with WordPress,20,1299,15,1 hour
HTML FOR BEGINNERS,20,791,8,1 hour
XML XQuery - Crash Course for Beginners,45,426,4,1 hour
Simplified Cross Browser Web Testing Using VirtualBox,20,796,3,1 hour
JavaScript and jQuery Basics: Start The Journey,25,1316,22,5 hours
How to Install WordPress From Scratch,Free,8415,56,1 hour
